{
  "$schema": "https://json-schema.org/draft/2020-12/schema",
  "title": "Regelzahlung",
  "type": "array",
  "items": {
    "type": "object",
    "required": ["regelzahlung_id", "bezeichnung", "betrag", "rhythmus_einheit", "rhythmus_intervall", "anker_datum", "status", "erstellt_am", "qualitaet"],
    "additionalProperties": false,
    "properties": {
      "regelzahlung_id": { "type": "string", "pattern": "^RZ-\\d{3,}$" },
      "bezeichnung": { "type": "string", "minLength": 1 },
      "betrag": { "type": "string", "pattern": "^(?!-0\\.00$)-?(0|[1-9]\\d*)\\.\\d{2}$" },
      "rhythmus_einheit": { "type": "string", "enum": ["tag", "woche", "monat", "jahr"] },
      "rhythmus_intervall": { "type": "integer", "minimum": 1 },
      "anker_datum": { "type": "string", "format": "date" },
      "aktiv_bis": { "type": "string", "format": "date" },
      "status": { "type": "string", "enum": ["vorgeschlagen", "bestaetigt", "abgelehnt"] },
      "kategorie_id": { "type": "string", "pattern": "^KAT-\\d{3,}$" },
      "darlehen_id": { "type": "string", "pattern": "^DAR-\\d{3,}$" },
      "vorsorge_id": { "type": "string", "pattern": "^VS-\\d{3,}$" },
      "konto_id": { "type": "string", "pattern": "^KTO-\\d{3,}$" },
      "erstellt_am": { "type": "string", "format": "date" },
      "qualitaet": { "type": "string", "enum": ["belegt", "geschaetzt"] },
      "quelle_hinweis": { "type": "string" },
      "quelle_standdatum": { "type": "string", "format": "date" },
      "bemerkung": { "type": "string" }
    }
  }
}
