[
  { "regelzahlung_id": "RZ-001", "bezeichnung": "Gehalt Lena", "betrag": "3200.00", "rhythmus_einheit": "monat", "rhythmus_intervall": 1, "anker_datum": "2026-07-01", "aktiv_bis": "2042-07-31", "status": "bestaetigt", "konto_id": "KTO-001", "kategorie_id": "KAT-001", "erstellt_am": "2026-06-01", "qualitaet": "belegt", "quelle_hinweis": "Demo-Gehaltsabrechnung", "quelle_standdatum": "2026-06-01" },
  { "regelzahlung_id": "RZ-002", "bezeichnung": "Gehalt Martin", "betrag": "2250.00", "rhythmus_einheit": "monat", "rhythmus_intervall": 1, "anker_datum": "2026-07-01", "status": "bestaetigt", "konto_id": "KTO-001", "kategorie_id": "KAT-001", "erstellt_am": "2026-06-01", "qualitaet": "belegt", "quelle_hinweis": "Demo-Gehaltsabrechnung", "quelle_standdatum": "2026-06-01" },
  { "regelzahlung_id": "RZ-003", "bezeichnung": "Kindergeld", "betrag": "510.00", "rhythmus_einheit": "monat", "rhythmus_intervall": 1, "anker_datum": "2026-07-03", "status": "bestaetigt", "konto_id": "KTO-001", "kategorie_id": "KAT-002", "erstellt_am": "2026-06-01", "qualitaet": "belegt", "quelle_hinweis": "Familienkasse Demo", "quelle_standdatum": "2026-06-01" },
  { "regelzahlung_id": "RZ-004", "bezeichnung": "Wohnungsdarlehen Rate", "betrag": "-1180.00", "rhythmus_einheit": "monat", "rhythmus_intervall": 1, "anker_datum": "2026-07-03", "status": "bestaetigt", "konto_id": "KTO-001", "kategorie_id": "KAT-012", "darlehen_id": "DAR-001", "erstellt_am": "2026-06-01", "qualitaet": "belegt", "quelle_hinweis": "Darlehensplan Demo", "quelle_standdatum": "2026-06-01" },
  { "regelzahlung_id": "RZ-005", "bezeichnung": "Hausgeld und Ruecklage", "betrag": "-360.00", "rhythmus_einheit": "monat", "rhythmus_intervall": 1, "anker_datum": "2026-07-04", "status": "bestaetigt", "konto_id": "KTO-001", "kategorie_id": "KAT-003", "erstellt_am": "2026-06-01", "qualitaet": "belegt", "quelle_hinweis": "Wirtschaftsplan Demo", "quelle_standdatum": "2026-06-01" },
  { "regelzahlung_id": "RZ-006", "bezeichnung": "Strom und Gas", "betrag": "-210.00", "rhythmus_einheit": "monat", "rhythmus_intervall": 1, "anker_datum": "2026-07-05", "status": "bestaetigt", "kategorie_id": "KAT-003", "erstellt_am": "2026-06-01", "qualitaet": "belegt", "quelle_hinweis": "Stadtwerke Demo", "quelle_standdatum": "2026-06-01" },
  { "regelzahlung_id": "RZ-007", "bezeichnung": "Internet und Mobilfunk", "betrag": "-84.00", "rhythmus_einheit": "monat", "rhythmus_intervall": 1, "anker_datum": "2026-07-08", "status": "bestaetigt", "kategorie_id": "KAT-003", "erstellt_am": "2026-06-01", "qualitaet": "belegt", "quelle_hinweis": "Provider Demo", "quelle_standdatum": "2026-06-01" },
  { "regelzahlung_id": "RZ-008", "bezeichnung": "Deutschlandtickets", "betrag": "-98.00", "rhythmus_einheit": "monat", "rhythmus_intervall": 1, "anker_datum": "2026-07-10", "status": "bestaetigt", "konto_id": "KTO-001", "kategorie_id": "KAT-005", "erstellt_am": "2026-06-01", "qualitaet": "belegt", "quelle_hinweis": "Verkehrsverbund Demo", "quelle_standdatum": "2026-06-01" },
  { "regelzahlung_id": "RZ-009", "bezeichnung": "Kita und Schulessen", "betrag": "-165.00", "rhythmus_einheit": "monat", "rhythmus_intervall": 1, "anker_datum": "2026-07-09", "status": "bestaetigt", "konto_id": "KTO-001", "kategorie_id": "KAT-006", "erstellt_am": "2026-06-01", "qualitaet": "belegt", "quelle_hinweis": "Kita Demo", "quelle_standdatum": "2026-06-01" },
  { "regelzahlung_id": "RZ-010", "bezeichnung": "Versicherungen", "betrag": "-115.00", "rhythmus_einheit": "monat", "rhythmus_intervall": 1, "anker_datum": "2026-07-11", "status": "bestaetigt", "kategorie_id": "KAT-007", "erstellt_am": "2026-06-01", "qualitaet": "belegt", "quelle_hinweis": "Versicherungsordner Demo", "quelle_standdatum": "2026-06-01" },
  { "regelzahlung_id": "RZ-011", "bezeichnung": "Lebensmittel Planwert", "betrag": "-820.00", "rhythmus_einheit": "monat", "rhythmus_intervall": 1, "anker_datum": "2026-07-15", "status": "bestaetigt", "kategorie_id": "KAT-004", "erstellt_am": "2026-06-01", "qualitaet": "geschaetzt", "quelle_hinweis": "Durchschnitt letzter Monate", "quelle_standdatum": "2026-06-01" },
  { "regelzahlung_id": "RZ-012", "bezeichnung": "ETF-Sparplan", "betrag": "-150.00", "rhythmus_einheit": "monat", "rhythmus_intervall": 1, "anker_datum": "2026-07-15", "status": "bestaetigt", "konto_id": "KTO-001", "kategorie_id": "KAT-009", "erstellt_am": "2026-06-01", "qualitaet": "belegt", "quelle_hinweis": "Depot-Sparplan Demo", "quelle_standdatum": "2026-06-01" },
  { "regelzahlung_id": "RZ-013", "bezeichnung": "Autokredit Rate", "betrag": "-265.00", "rhythmus_einheit": "monat", "rhythmus_intervall": 1, "anker_datum": "2026-07-15", "status": "bestaetigt", "kategorie_id": "KAT-012", "darlehen_id": "DAR-002", "erstellt_am": "2026-06-01", "qualitaet": "belegt", "quelle_hinweis": "Autokredit Demo", "quelle_standdatum": "2026-06-01" },
  { "regelzahlung_id": "RZ-014", "bezeichnung": "Riester-Beitrag Lena", "betrag": "-162.00", "rhythmus_einheit": "monat", "rhythmus_intervall": 1, "anker_datum": "2026-01-01", "status": "bestaetigt", "erstellt_am": "2026-01-01", "kategorie_id": "KAT-007", "qualitaet": "belegt", "vorsorge_id": "VS-003" },
  { "regelzahlung_id": "RZ-015", "bezeichnung": "Private RV Martin", "betrag": "-150.00", "rhythmus_einheit": "monat", "rhythmus_intervall": 1, "anker_datum": "2026-01-01", "status": "bestaetigt", "erstellt_am": "2026-01-01", "kategorie_id": "KAT-007", "qualitaet": "belegt", "vorsorge_id": "VS-004" },
  { "regelzahlung_id": "RZ-016", "bezeichnung": "Risiko-LV Martin", "betrag": "-28.00", "rhythmus_einheit": "monat", "rhythmus_intervall": 1, "anker_datum": "2026-01-01", "status": "bestaetigt", "erstellt_am": "2026-01-01", "kategorie_id": "KAT-007", "qualitaet": "belegt", "vorsorge_id": "VS-005" },
  { "regelzahlung_id": "RZ-017", "bezeichnung": "KFZ-Haftpflicht (alt)", "betrag": "-92.00", "rhythmus_einheit": "jahr", "rhythmus_intervall": 1, "anker_datum": "2025-01-01", "aktiv_bis": "2026-12-31", "status": "bestaetigt", "erstellt_am": "2025-01-01", "kategorie_id": "KAT-007", "qualitaet": "belegt", "vorsorge_id": "VS-007" },
  { "regelzahlung_id": "RZ-018", "bezeichnung": "KFZ-Haftpflicht (neu)", "betrag": "-88.00", "rhythmus_einheit": "jahr", "rhythmus_intervall": 1, "anker_datum": "2027-01-01", "status": "bestaetigt", "erstellt_am": "2026-12-01", "kategorie_id": "KAT-007", "qualitaet": "belegt", "vorsorge_id": "VS-008" },
  { "regelzahlung_id": "RZ-019", "bezeichnung": "Hausratversicherung", "betrag": "-96.00", "rhythmus_einheit": "jahr", "rhythmus_intervall": 1, "anker_datum": "2026-04-01", "status": "bestaetigt", "erstellt_am": "2026-01-01", "kategorie_id": "KAT-007", "qualitaet": "belegt", "vorsorge_id": "VS-009" }
]
